post_id,subreddit,author,title,selftext,url,ups,downs,score,num_comments,created_utc,permalink,domain
1nowzaf,autismmemes,_RPGabe_,Mod statement regarding autism and Tylenol,"Hello everyone, 

The mod-team has come together and decided to give a statement regarding Donald Trump and RFK Jr. saying Tylenol/acetaminophen/paracetamol causes autism. We don't know what public policy repercussions, if any, will come in the future from these words, but we felt it was important to give context and clear up a few misconceptions.

First, correlation between Tylenol and autism has not been proven with any rigorous scientific analysis.[ This article from PBS ](https://www.pbs.org/newshour/health/research-doesnt-show-using-tylenol-during-pregnancy-causes-autism-here-are-5-things-to-know)gives a good overview, as well as this interview from [Yale School of Public Health](https://ysph.yale.edu/news-article/what-the-research-says-about-autism-and-tylenol-use-during-pregnancy/). Both of these articles have references of their own as well for further reading. While some studies may claim there is an association, there is a different between association and correlation, or association and causation. 

Second, it's important to highlight why the Trump administration is pushing this agenda. As highlighted in the references above, Tylenol is consistently the most safe pain medication to take during pregnancy. This is clearly part of the continuous attack on reproductive rights. 

It is also worth mentioning that the alternative being pushed is leucovorin, otherwise known as folinic acid. Folinic acid is sold by Dr. Oz, a celebrity quack doctor who is the Administrator of the Centers for Medicare &amp; Medicaid Services (CMS) in the Trump administration. Dr. Oz's company website, iHerb, has a disclaimer saying, ""[ Not Healthcare Advice  The products and claims made about specific products on or through this Site have not been evaluated by the United States Food and Drug Administration and are not approved to diagnose, treat, cure or prevent disease.](https://nl.iherb.com/info/disclaimer)"" iHerb and Dr. Oz have consistently failed to meet FDA guidelines, follow scientific standards, and much more. FDA guidelines under Trump may change in the future, but this is still an important piece to highlight. Just like with Elon Musk gutting the government, Trump has filled the US government with his colleagues and business partners and are consistently trying to make revenue, at the expense of us.

Last but not least, it is important to push back against the eugenicist arguments stemming from this. The underlying assumption, or warrant in these people's arguments, is that having autism is inherently wrong and therefore it must be destroyed. The truth is that autistic people are valid, wonderful, and an integral part of societies of the past, present, and future. There is no getting rid of us, and the world would not be better without us. 

Many of the troubles that come with being autistic are often external factors. This can look like parents and peers not knowing how to be supportive, a lack of accommodations, general misconceptions people have, minimal disability rights globally, and so much more. A world that centers disability rights and accommodations is a world that is more accessible and better for everyone. Instead of blaming individuals and constantly criminalizing more and more, we should seek to create systems and societies that uplift everyone. That will help far more than criminalizing/banning Tylenol, and the other things that the Trump administration pushes like criminalizing homelessness, funding more and more police and ICE, and stripping people of their autonomy and humanity, are all part of this same ideology and are connected. 

It's not often we make mod statements, especially political ones, but in this day and age, not making a statement is a position in itself. We refuse to be silent as we and others are targeted. Now, more than ever, it is important we fight back against a wave of lies, fascism, and dangerous rhetoric. We must seek to build community, find ways of resisting, and come together. We might just be a meme subreddit, but we hope to be a part of community and help build it online (which is not a substitute for real life organizing!) and create a space that is safe for all of us. And that means calling out bullshit. 

All that to say, posts spreading misinformation are not acceptable. There is a line between memes and humor and promoting unscientific facts as truth. While there are some concerns about [irony poisoning](https://en.wikipedia.org/wiki/Irony_poisoning), posts making fun of this admittedly absurd statement are not outright banned, as of this moment. Just keep in mind the context your posts are made in. 

Stay safe everyone. Go pop a Tylenol for the headache Trump's statements are giving us. And take care.",https://www.reddit.com/r/autismmemes/comments/1nowzaf/mod_statement_regarding_autism_and_tylenol/,802,0,802,61,1758670531.0,/r/autismmemes/comments/1nowzaf/mod_statement_regarding_autism_and_tylenol/,self.autismmemes
1no1q00,publichealth,TheYellowRose,Tylenol and autism megathread,"With the United States public health system being run into the ground by unscientific weirdos we now have this -  https://www.hhs.gov/press-room/hhs-trump-kennedy-autism-initiatives-leucovorin-tylenol-research-2025.html.

Please keep all commentary related to the Tylenol and autism announcement contained here so it doesn't take over the subreddit. Thank you.",https://www.reddit.com/r/publichealth/comments/1no1q00/tylenol_and_autism_megathread/,328,0,328,135,1758583079.0,/r/publichealth/comments/1no1q00/tylenol_and_autism_megathread/,self.publichealth
1n9c8w4,thescoop,OregonSasquatch14,Not a joke. RFK Jr/HHS says autism caused by Tylenol 🙄,https://www.wsj.com/health/healthcare/rfk-jr-hhs-to-link-autism-to-tylenol-use-in-pregnancy-and-folate-deficiencies-e3acbb4c,https://i.redd.it/ne61yyaqxdnf1.jpeg,308,0,308,151,1757095059.0,/r/thescoop/comments/1n9c8w4/not_a_joke_rfk_jrhhs_says_autism_caused_by_tylenol/,i.redd.it
1not4v5,TrueReddit,wiredmagazine,"Trump’s Tylenol Directive Could Actually Increase Autism Rates, Researchers Warn",,https://www.wired.com/story/trumps-tylenol-directive-could-actually-increase-autism-rates-researchers-warn/,655,0,655,54,1758660905.0,/r/TrueReddit/comments/1not4v5/trumps_tylenol_directive_could_actually_increase/,wired.com
1no1r7l,inthenews,geoxol,"Trump links autism to Tylenol and vaccines, claims not backed by science",,https://www.reuters.com/business/healthcare-pharmaceuticals/trump-expected-link-autism-with-tylenol-experts-say-more-research-needed-2025-09-22/,407,0,407,83,1758583171.0,/r/inthenews/comments/1no1r7l/trump_links_autism_to_tylenol_and_vaccines_claims/,reuters.com
1nnqh0f,redscarepod,tasmanian_god,Tylenol Causes Autism,,https://i.redd.it/z1w14b6eoqqf1.png,197,0,197,134,1758556866.0,/r/redscarepod/comments/1nnqh0f/tylenol_causes_autism/,i.redd.it
1np52ps,Feminism,Myllicent,The Trump Administration’s Tylenol in Pregnancy Claims Are the Newest Way to Blame Mothers for Autism,The Trump administration’s efforts to link moms who take Tylenol in pregnancy to autism in children is the latest attempt to shame women over the condition.,https://www.glamour.com/story/trump-tylenol-pregnancy-claims-blame-mothers-for-autism,861,0,861,37,1758695797.0,/r/Feminism/comments/1np52ps/the_trump_administrations_tylenol_in_pregnancy/,glamour.com
1nom4p3,NewsSource,vladdragovych,GOP senator breaks with Trump on linking Tylenol to autism: ‘Not the case’,,https://nypost.com/2025/09/23/us-news/gop-sen-bill-cassidy-breaks-with-trump-on-linking-tylenol-to-autism-not-the-case/,878,0,878,36,1758645008.0,/r/NewsSource/comments/1nom4p3/gop_senator_breaks_with_trump_on_linking_tylenol/,nypost.com
1noqpoi,inthenews,msnbc,Opinion | Trump’s reckless announcement linking Tylenol and autism is already doing major damage,,https://www.msnbc.com/opinion/msnbc-opinion/autism-tylenol-kennedy-trump-leucovorin-acetaminophen-evidence-rcna232990,445,0,445,70,1758655342.0,/r/inthenews/comments/1noqpoi/opinion_trumps_reckless_announcement_linking/,msnbc.com
1nr6xq1,skeptic,bgoodwood,Tylenol is the cause of Autism! (According to Trump and RFK Jr.) - Prof Dave Explains,,https://youtu.be/ohsYDUj0gfU?si=KaaBcYlp4A7YLCGq,248,0,248,105,1758906427.0,/r/skeptic/comments/1nr6xq1/tylenol_is_the_cause_of_autism_according_to_trump/,youtu.be
1nrxj3x,TrendoraX,satty237,"🚨 BREAKING: Trump Links Tylenol to Autism, Questions Vaccine Safety - Science Community Fires Back","President Trump just dropped major claims about vaccines and autism that have the medical world in an uproar. In a White House briefing, he:

Called for major changes to childhood vaccine schedules

Claimed Tylenol during pregnancy causes autism

Suggested MMR vaccines should be given separately

Promoted leucovorin as an autism ""treatment""

The Science Says: Multiple studies involving 650K+ children found ZERO link between vaccines and autism. Medical experts are calling these claims ""dangerous misinformation.""

What's Really Happening? This appears to be a calculated move to energize his MAGA base while contradicting decades of established medical research.

The Autism Science Foundation and major medical organizations have issued strong statements against these claims. Public health experts worry this could lead to decreased vaccination rates and disease outbreaks.

Your Take: Are these genuine health concerns or political theater? How should parents navigate conflicting information about their children's health?

Sources: Multiple recent reports from NPR, BBC, Nature, Reuters",https://i.redd.it/p6wjsmp43qrf1.png,69,0,69,158,1758985552.0,/r/TrendoraX/comments/1nrxj3x/breaking_trump_links_tylenol_to_autism_questions/,i.redd.it
1np9vho,WatchWhatCrappens,RBFgirl,"Okay, Britt!","I’m really happy to see Brittany being outspoken about this! I do hope she extrapolates it into the rest of her politics, but either way I’m happy to see her defending Cruz, mothers of autistic children and the Autism community against the vile misinformation that Trump &amp; RFK are spreading. ",https://i.redd.it/i5db2879o3rf1.jpeg,5643,0,5643,476,1758714196.0,/r/WatchWhatCrappens/comments/1np9vho/okay_britt/,i.redd.it
1nnquqo,adhdmeme,native-abstraction,"Apparently, the Trump administration has solved neurodiversity","Rumor is that they are going make an announcement today that Tylenol is to blame for stuff like ADHD and autism.

From my limited research, it's [my understanding that](https://www.pbs.org/newshour/health/research-doesnt-show-using-tylenol-during-pregnancy-causes-autism-here-are-5-things-to-know):

&gt;Mothers who are genetically predisposed toward autism or ADHD are more likely to have conditions that cause them to use acetaminophen — and that same genetic predisposition could be what increases the likelihood of a child having those conditions

I'd love to get feedback from this group though. Honestly, lately, the only people I trust to teach me stuff about ADHD are people who have it.",https://i.redd.it/7ajw2kgjpqqf1.gif,5769,0,5769,471,1758557712.0,/r/adhdmeme/comments/1nnquqo/apparently_the_trump_administration_has_solved/,i.redd.it
1np19bt,AskTrumpSupporters,Lavaswimmer,What are your thoughts on the recent press conference from Trump and RFK linking autism to Tylenol?,"Link to the press conference in full: https://www.youtube.com/watch?v=YinEMgW-0Uc

What are your thoughts?",https://www.reddit.com/r/AskTrumpSupporters/comments/1np19bt/what_are_your_thoughts_on_the_recent_press/,63,0,63,157,1758682769.0,/r/AskTrumpSupporters/comments/1np19bt/what_are_your_thoughts_on_the_recent_press/,self.AskTrumpSupporters
1nnwelp,Quebec,Puzzled_Dreamer2453,Trump s’apprêterait à lier le Tylenol à l’autisme,,https://ici.radio-canada.ca/nouvelle/2194284/trump-kennedy-autisme-acetaminophene-tylenol-leucovorin?partageApp=rcca_appmobile_appinfo_android,111,0,111,133,1758570123.0,/r/Quebec/comments/1nnwelp/trump_sapprêterait_à_lier_le_tylenol_à_lautisme/,ici.radio-canada.ca
1npgxm7,pregnant,nbcnews,Have the unproven connections RFK Jr. and President Trump have made between Tylenol and autism made you rethink taking the medication?,"We're a group of NBC News reporters hoping to learn whether the links RFK Jr. and President Trump have made between taking Tylenol during pregnancy and autism have any expectant mothers rethinking the medication. Whether in U.S. or elsewhere, we're interested in hearing from you.",https://www.reddit.com/r/pregnant/comments/1npgxm7/have_the_unproven_connections_rfk_jr_and/,11,0,11,189,1758731579.0,/r/pregnant/comments/1npgxm7/have_the_unproven_connections_rfk_jr_and/,self.pregnant
1npn49z,television,ControlCAD,Escalator Justice | Trump To United Nations: You Suck | Blame Tylenol | “It Can Only Good Happen” | The Late Show with Stephen Colbert,"&gt;President Trump had a hard time getting to the podium for his welcome speech at the United Nations General Assembly, where he told world leaders that their countries are going to hell. One day earlier, the president blamed Tylenol for causing autism and encouraged pregnant women to tough it out if they’re experiencing pain.",https://www.youtube.com/watch?v=cb5u_pPqmgw,465,0,465,52,1758745762.0,/r/television/comments/1npn49z/escalator_justice_trump_to_united_nations_you/,youtube.com
1no9x1u,conspiracy,forblkonly,Why Trump is saying Tylenol causes tism,"Why is Trump and his pal dr.oz saying Tylenol and not the generic acetaminophen?

Tylenol is owned by kenvue a spin off of j&amp;j establishes in 2023 a brand that focus on health and beauty with products like Tylenol and neutrogena lotion.

Iherb is one of dr.oz largest investments that he has not divested from.

They are pushing folonic acid to “treat symptoms” of autism. 

Guess what company sells folonic acid…iherb!!!

Dr.oz is using this to get rich. There is zero evidence that Tylenol causes autism and is the safest treatment for fever for pregnant women. A fever during pregnancy can harm both mom and baby. 

There are many reasons for the rise in autism diagnosis, including parental age, diagnostic criteria and the fact that we don’t send people to rot in asylums. This is blatant abuse and needs to be called out.",https://www.reddit.com/r/conspiracy/comments/1no9x1u/why_trump_is_saying_tylenol_causes_tism/,103,0,103,129,1758608354.0,/r/conspiracy/comments/1no9x1u/why_trump_is_saying_tylenol_causes_tism/,self.conspiracy
1nrjhwz,PoliticalHumor,TheLordOfMidnight,"""Make Autism Gone Again"" says Trump, as he signs an executive order banning Tylenol",What absolutely moronic times we live in.,https://i.redd.it/epgd2y3w8mrf1.jpeg,506,0,506,46,1758939067.0,/r/PoliticalHumor/comments/1nrjhwz/make_autism_gone_again_says_trump_as_he_signs_an/,i.redd.it
1no6ev7,NewsThread,Former_Goose_5202,Trump Urges Pregnant Women to Avoid Tylenol Over Autism Concerns,"US President Donald Trump has urged pregnant women to avoid using Tylenol, claiming there is a possible link between the pain reliever and autism. Speaking from the Oval Office alongside Health Secretary Robert F Kennedy Jr, Trump said the drug, also known as paracetamol or acetaminophen, should only be taken during pregnancy in cases of extreme fever.

The announcement comes as health authorities prepare to advise doctors against prescribing the medication to expectant mothers. The Food and Drug Administration is expected to issue a notice to physicians, initiate a label change, and launch a public health campaign highlighting potential risks.

Trump described the rise in autism cases as a “horrible crisis.” Kennedy added that the FDA will soon approve Leucovorin, a decades-old drug traditionally used in cancer treatment, as a therapy for some children with autism linked to folate deficiency.

Medical experts, however, have cautioned that the evidence linking Tylenol to autism is inconclusive, and that acetaminophen remains one of the safest pain relief options available to pregnant women. Studies have produced conflicting results, with some suggesting a possible connection while others find no clear association.

Autism rates have risen significantly in recent decades, though researchers attribute much of the increase to broader diagnostic criteria and improved awareness. Experts continue to stress that autism likely results from a complex mix of genetic and environmental factors rather than a single cause.
",https://i.redd.it/z4gdv6odytqf1.jpeg,0,0,0,189,1758596548.0,/r/NewsThread/comments/1no6ev7/trump_urges_pregnant_women_to_avoid_tylenol_over/,i.redd.it
1no0e23,politics,jurornumber1,"'Amish have no autism,' claims Trump as he links Tylenol to the condition",,https://news.sky.com/video/amish-have-no-autism-claims-trump-13436475,130,0,130,114,1758579546.0,/r/politics/comments/1no0e23/amish_have_no_autism_claims_trump_as_he_links/,news.sky.com
1nop2ft,AnythingGoesNews,-Appleaday-,Tylenol denies Trump's link between acetaminophen and autism,,https://www.axios.com/2025/09/23/tylenol-trump-autism-acetaminophen-paracetamol,327,0,327,63,1758651620.0,/r/AnythingGoesNews/comments/1nop2ft/tylenol_denies_trumps_link_between_acetaminophen/,axios.com
1nrko9y,behindthebastards,vemmahouxbois,harvard public health dean took $150k to testify tylenol causes autism,"Harvard School of Public Health Dean Andrea A. Baccarelli received at least $150,000 to testify against Tylenol’s manufacturer in 2023 — two years before he published research used by the Trump administration to link the drug to autism, a connection experts say is tenuous at best.

Baccarelli served as an expert witness on behalf of parents and guardians of children suing Johnson &amp; Johnson, the manufacturer of Tylenol at the time. U.S. District Court Judge Denise L. Cote dismissed the case last year due to a lack of scientific evidence, throwing out Baccarelli’s testimony in the process.

“He cherry-picked and misrepresented study results and refused to acknowledge the role of genetics in the etiology” of autism spectrum disorder or ADHD, Cote wrote in her decision, which the plaintiffs have since appealed.

Baccarelli, who was a professor at Columbia University’s public health school at the time, declined to comment on his involvement in the case.",https://www.thecrimson.com/article/2025/9/24/autism-dean-public-health/?utm_campaign=feed&amp;utm_medium=referral&amp;utm_source=later-linkinbio,609,0,609,31,1758942721.0,/r/behindthebastards/comments/1nrko9y/harvard_public_health_dean_took_150k_to_testify/,thecrimson.com
1nq6gtv,DHAC,SudhaSameera,"GOP senator and licensed doctor Bill Cassidy on Trump linking autism, Tylenol: ‘Not the case’",,https://thehill.com/policy/healthcare/5517446-gop-senator-on-trump-linking-autism-tylenol-not-the-case/amp/,1108,0,1108,10,1758806106.0,/r/DHAC/comments/1nq6gtv/gop_senator_and_licensed_doctor_bill_cassidy_on/,thehill.com
1nqc6py,EverythingScience,burtzev,Research tying Tylenol to autism lost in court. Then it won Trump’s ear.,,https://archive.is/iXV60,493,0,493,40,1758819500.0,/r/EverythingScience/comments/1nqc6py/research_tying_tylenol_to_autism_lost_in_court/,archive.is
1nno5d5,Qult_Headquarters,RickySan65,Trump will reportedly link Tylenol to autism,,https://www.bbc.com/news/articles/cx20d4lr67lo,277,0,277,66,1758551665.0,/r/Qult_Headquarters/comments/1nno5d5/trump_will_reportedly_link_tylenol_to_autism/,bbc.com
1no506s,inthenews,BitterFuture,Trump attacks Tylenol as officials unveil highly contentious conclusions on autism,,https://www.theguardian.com/us-news/2025/sep/22/trump-administration-autism-causes,305,0,305,61,1758592362.0,/r/inthenews/comments/1no506s/trump_attacks_tylenol_as_officials_unveil_highly/,theguardian.com
1npgu6e,goodnews,Estella_the_Wanderer,"World health experts reject Trump and RFK Jr.'s claims about Tylenol, autism link",,https://www.cbsnews.com/news/world-health-experts-trump-tylenol-autism-link/?utm_source=convertkit&amp;utm_medium=email&amp;utm_campaign=%F0%9F%97%9E%EF%B8%8F%20Good%20News:%20New%20conservation%20school%20established%20with%20historic%20grant%20-%2019102241&amp;sh_kit=bfabdcd4e70ec734224a920d39c54ef2bb127879a38514d21e44f55099c49395,608,0,608,30,1758731366.0,/r/goodnews/comments/1npgu6e/world_health_experts_reject_trump_and_rfk_jrs/,cbsnews.com
1nohxsm,AuDHDWomen,LenaHauser15,WTF? Tylenol and autism.,"ok im sure we all heard. When pregnant women take Tylenol the kid will be Autistic. Which is 100% wrong! I absolutely full heartedly HATE rfk jr. He is trying to make healing farms, find a cure and cause to AUTISM and now has convinced trump that autism is caused by smth. Im sorry what!??! So i follow this one girl and shes Autistic and she posted this: (1st image) THANK YOUUUU! Someone is saying the truth. Plus i found this while reading articles about the whole tylenol and autism fiasco: (2nd image) sorry let me double check that last line. Yep exactly what i thought. Im not speaking for all Autistics but for me yes Autism and adhd make my life bard and make me feel disabled but i would never ask for a cure for autism maybe adhd but i can never imagine myself not autistic. And maybe before trying to find a ""cure"" to autism maybe take some polls to see if any of us even want a cure.... just a thought. Anywho my day has now been ruined.",https://www.reddit.com/gallery/1nohxsm,329,0,329,56,1758635415.0,/r/AuDHDWomen/comments/1nohxsm/wtf_tylenol_and_autism/,reddit.com
1nqlwes,thenextgenbusiness,kelseyrainbow,Obama criticizes Trump administration claim linking Tylenol use in pregnancy with autism,Former President Barack Obama criticized the Trump administration’s recent statements connecting autism with Tylenol use during pregnancy. Obama accused the administration of engaging in what he described as “violence against the truth.”,https://thenextgenbusiness.com/news/obama-criticizes-trump-administration-claim-linking-tylenol-use-in-pregnancy-with-autism/,74,0,74,113,1758842650.0,/r/thenextgenbusiness/comments/1nqlwes/obama_criticizes_trump_administration_claim/,thenextgenbusiness.com
1nog5m8,inthenews,chrisdh79,"Trump, 79, Struggles to Say Word for Tylenol in His Dumb Autism Speech | Donald Trump struggled to even pronounce the word “acetaminophen” during his winding rant.",,https://newrepublic.com/post/200772/donald-trump-tylenol-pregnancy-autism-rant,450,0,450,40,1758630851.0,/r/inthenews/comments/1nog5m8/trump_79_struggles_to_say_word_for_tylenol_in_his/,newrepublic.com
1no1enc,AutisticPride,DragonflyKey4972,"Trump and RFK's big, beautiful autism answer","They made it official. Pregnant women taking Tylenol causes it, according to the pumpkin and worm-brain man. Autism runs in my family from way back including my maternal grandparents (both born before 1920).  My mom had two cousins (born in the mid-1940s) who were autistic and the Soviets took the girl away and turned her into a vegetable and then she died, so they could try to ""cure"" her.  Although acetaminophen was discovered in 1878, it was NOT rolled out to consumers until 1956. They believe da Vinci and other great artists/inventors were autistic.  The only answer is-- their moms had time travel machines, came to the future and stocked up on Tylenol. Also, my mom did not take Tylenol while pregnant with me. And she was  happy, lived in a small town, and they grew their own fruits and veggies. Also-- we're to assume then, that most mothers never took Tylenol since most people are NT? 

 BTW, our newspaper had an article that--  BEFORE this ""research,"" RFK and Trump DEFUNDED the other autism research groups and then made everyone apply under RFK. One anonymous scientist said he hopes the groups won't bend to RFK's (psycho) will to get funding. Looks like they did.",https://www.reddit.com/r/AutisticPride/comments/1no1enc/trump_and_rfks_big_beautiful_autism_answer/,244,0,244,67,1758582231.0,/r/AutisticPride/comments/1no1enc/trump_and_rfks_big_beautiful_autism_answer/,self.AutisticPride
1nn1gdp,Law_and_Politics,Barch3,"Trump administration set to tie Tylenol to autism risk, officials say. Officials will also tout the drug leucovorin as a potential autism treatment, in what President Donald Trump has billed as a “very important” announcement.",,https://archive.ph/2025.09.21-185940/https://www.washingtonpost.com/health/2025/09/21/trump-autism-announcement-tylenol-leucovorin/,223,0,223,64,1758483524.0,/r/Law_and_Politics/comments/1nn1gdp/trump_administration_set_to_tie_tylenol_to_autism/,archive.ph
1nr0d3p,Health,crustose_lichen,Sinclair joins the Trump administration’s much-criticized attempt to link Tylenol use during pregnancy to autism,,https://www.mediamatters.org/sinclair-broadcast-group/sinclair-joins-trump-administrations-much-criticized-attempt-link-tylenol,358,0,358,44,1758890655.0,/r/Health/comments/1nr0d3p/sinclair_joins_the_trump_administrations/,mediamatters.org
1nq7u3z,Republican,MackSix,When TDS Turns Deadly! Here's What Happened to Pregnant Women Swallowing Tylenol While Pregnant Since Trump Suggested It May Cause Autism,,https://redstatenation.com/when-tds-turns-deadly-heres-what-happened-to-pregnant-women-swallowing-tylenol-while-pregnant-since-trump-suggested-it-may-cause-autism/,164,0,164,72,1758809468.0,/r/Republican/comments/1nq7u3z/when_tds_turns_deadly_heres_what_happened_to/,redstatenation.com
