post_id,subreddit,author,title,selftext,url,ups,downs,score,num_comments,created_utc,permalink,domain
1npjcco,TrueUnpopularOpinion,SuccessfulCompany294,Tylenol in their own words,"Many people are wrong about this latest Tylenol controversy who say its totally safe for pregnant women. 

This post has nothing to do with the autism claims which is why this subject is even news, but I will post the two studies and you can read them for yourself. I do not and am not making any claim that Tylenol causes autism.

This will be be about the claim that Tylenol is safe for pregnant women.  

Tylenol in 2017 said they do not recommend taking ANY of their products during pregnancy. This isn’t a conspiracy against Tylenol it’s their own recommendation. Now everyone is coming out saying it’s safe for pregnancy. What an odd coincidence I wonder what changed? 

Did someone say something that people didn’t like? Tylenol has NEVER actually conducted studies on their own drug to see if it IS safe for pregnant women. They have only RECENTLY in the last day said they have a study, but have not posted ANY proof of it. 

Previously people were saying there is no study cause its not safe to conduct it on pregnant women. Mind you, Pregnant women are advised to stay away from almost every pharmaceutical drug, listen to any pharmaceutical commercial, you will hear them say ""Do not take if you are pregnant or trying to be.""

So how is there an ethical study now, that previously has never been released and does this study exist today one day after this news broke, when it didn't exist last week. Who conducted an ethical study on pregnant women and how was it conducted. ZERO PROOF Offered, all talk zero evidence, and if you THINK there is proof, post it here.

Anyone here, now or in the future saying its safe for pregnant women to take drugs prescription or not is lying to you, every Pharma commercial literally tells you not to. Just listen to any of them on TV every other commercial. 

So whats easier, put it on the market and make it OTC, so anyone can buy it and just say ""ask your doctor."" What study does your doctor have to go off of? Let me guess millions of people rush to their doctor for recommendations about OTC meds, lmfao. Tylenol took the easy way out. Trump has somehow managed to make the anti big pharma be totally in the pocket of big pharma, imagine that.

There are people in this very thread trying to now claim that just because Tylenol says they recommend you not take it while pregnant is them saying they are not actually telling you to not take it. Read that twice, then read through this thread.

However now, just a few years later after Tylenol said they do not recommend pregnant women take this drug, people want you taking it.

https://www.acog.org/news/news-releases/2025/09/acog-affirms-safety-benefits-acetaminophen-pregnancy

In 2013 Reuters Health published this.

https://www.reuters.com/article/business/healthcare-pharmaceuticals/too-much-tylenol-in-pregnancy-could-affect-development-idUSBRE9AL15M/

Too much Tylenol in pregnancy could affect development
By Kathryn Doyle November 22, 2013

NEW YORK (Reuters Health) - Expectant mothers often take Tylenol, with the active ingredient acetaminophen, to deal with back pain, headaches or mild fevers during pregnancy. But frequent use may be linked to poorer language skills and behavior problems among their children, according to a new study.

As the most popular over-the-counter drug in the U.S., Tylenol has been extensively studied in relation to premature birth and miscarriage, with no connections found.

But its maker Johnson &amp; Johnson periodically comes under fire for the drug's small therapeutic index - that is, the difference between an effective dose and a dangerous dose is quite small. So interest in investigating the drug persists.
The new study is the first to look at young children whose mothers took Tylenol while pregnant.

""Our findings suggest that (acetaminophen) might not be as harmless as we think,"" Ragnhild Eek Brandlistuen said. She led the study at the School of Pharmacy at the University of Oslo in Norway.

She and her coauthors studied 48,000 Norwegian children whose mothers answered survey questions about their medication use at weeks 17 and 30 of pregnancy, and again six months after giving birth.

Mothers filled out a follow-up questionnaire about their child's developmental milestones three years later.
Close to four percent of women took Tylenol for at least 28 days total during pregnancy.

Their children seemed to have poorer motor skills than kids whose mothers had taken the drug fewer times or not at all. Tylenol-exposed kids also tended to start walking later, have poorer communication and language skills and more behavior problems.

It's difficult to define risks for pregnant women and their children, since rigorous tests and controlled studies of drug exposure aren't ethical, Brandlistuen said. All researchers can do is closely observe women in the real world.


But this study, published in the International Journal of Epidemiology, involved a large number of women, and researchers also looked for any link to ibuprofen, a pain-relief alternative without acetaminophen.

They found no development problems tied to ibuprofen.

As far as Autism, there are studies and I don't know the validity of them nor will I make judgement, I will just post them. I dont wish to get into the autism debate, I only wish to address the claims that somehow Tylenol is now somehow safe and there IS an ethical study by Tylenol that didn't exist until Yesterday.

Mount Sini Study 

""New York, NY (August 13, 2025)  Researchers at the Icahn School of Medicine at Mount Sinai have found that prenatal exposure to acetaminophen may increase the risk of neurodevelopmental disorders, including autism spectrum disorder and attention-deficit/hyperactivity disorder (ADHD), in children. The study, published today in BMC Environmental Health, is the first to apply the rigorous Navigation Guide methodology to systematically evaluate the rigor and quality of the scientific literature.

Acetaminophen (often sold under the brand name Tylenol®, and known as paracetamol outside the United States and Canada) is the most commonly used over-the-counter pain and fever medication during pregnancy and is used by more than half of pregnant women worldwide. Until now, acetaminophen has been considered the safest option for managing headache, fever, and other pain. Analysis by the Mount Sinai-led team of 46 studies incorporating data from more than 100,000 participants across multiple countries challenges this perception and underscores the need for both caution and further study.""

https://www.mountsinai.org/about/newsroom/2025/mount-sinai-study-supports-evidence-that-prenatal-acetaminophen-use-may-be-linked-to-increased-risk-of-autism-and-adhd

In 2019 JHU Published this study.

""Taking Tylenol during pregnancy associated with elevated risks for autism, ADHD
A Johns Hopkins study analyzing umbilical cord blood samples found that newborns with the highest exposure to acetaminophen were about three times more likely to be diagnosed with ADHD or autism spectrum disorder in childhood""

https://hub.jhu.edu/2019/11/05/acetaminophen-pregnancy-autism-adhd/


https://x.com/tylenol/status/839196906702127106?s=46",https://i.redd.it/8j2tku1ck5rf1.jpeg,1027,0,1027,462,1758737090.0,/r/TrueUnpopularOpinion/comments/1npjcco/tylenol_in_their_own_words/,i.redd.it
1nofl6f,politicalsham,NealTheBotanist,"Trump administration falsely claims that Tylenol causes autism, a statement widely discredited by medical experts --- ZERO DATA INDICATES HIS CLAIM AS FACT.",,https://v.redd.it/vpcg8cbmnsqf1,95,0,95,30,1758629257.0,/r/politicalsham/comments/1nofl6f/trump_administration_falsely_claims_that_tylenol/,v.redd.it
1nqdmzt,videos,ishtar_the_move,I tried to understand Trump’s argument that Tylenol causes autism | About That,,https://www.youtube.com/watch?v=MLSIyUFZ2Vg,0,0,0,46,1758822785.0,/r/videos/comments/1nqdmzt/i_tried_to_understand_trumps_argument_that/,youtube.com
1nnnmba,BoycottUnitedStates,Prosecco1234,Trump will reportedly link Tylenol to autism - but many experts are sceptical,,https://www.bbc.com/news/articles/cx20d4lr67lo,90,0,90,31,1758550433.0,/r/BoycottUnitedStates/comments/1nnnmba/trump_will_reportedly_link_tylenol_to_autism_but/,bbc.com
1no9v0o,cybersucks,co_nasty69,"Out of the Loop: Trump, Autism and Tylenol",I'm confused about the angle here - why Tylenol? Are Kenvue's competitors in a merger lawsuit or something? Doesn't Big Pharma have enough transactional leverage to prevent something like this? Seems out of step. ,https://www.reddit.com/r/cybersucks/comments/1no9v0o/out_of_the_loop_trump_autism_and_tylenol/,20,0,20,39,1758608149.0,/r/cybersucks/comments/1no9v0o/out_of_the_loop_trump_autism_and_tylenol/,self.cybersucks
1no26k9,TransgendersAtWar,panda_bruh,So glad trump found the cause of my autism,,https://i.redd.it/b2846yb5ysqf1.jpeg,101,0,101,26,1758584350.0,/r/TransgendersAtWar/comments/1no26k9/so_glad_trump_found_the_cause_of_my_autism/,i.redd.it
1nphkuv,Conservative,joetravers,Critics uncover Tylenol's cautionary tweet for pregnant moms after Trump highlights autism link,,https://www.theblaze.com/news/critics-seize-upon-tylenols-cautionary-tweet-after-trump-highlights-autism-link,149,0,149,20,1758733052.0,/r/Conservative/comments/1nphkuv/critics_uncover_tylenols_cautionary_tweet_for/,theblaze.com
1nqyoo6,libsofreddit,BowlingForAmmo,For all the leftists who are losing their minds because Donald Trump cited a Harvard study linking acetaminophen usage during pregnancy to an increased risk of autism in children...,,https://i.redd.it/s0xk4drzthrf1.jpeg,249,0,249,10,1758885628.0,/r/libsofreddit/comments/1nqyoo6/for_all_the_leftists_who_are_losing_their_minds/,i.redd.it
1no410b,AskConservatives,Orion032,"Why is Tylenol bad but Leuxovorin fine, when both have roughly the same level of study supporting the claims Trump is making about them?","So after looking into the studies, here’s what I found:

Yes there is small evidence showing a correlation between acetaminophen and autism, but the FDA in their statement has even recognized this doesn’t equal causation. If you want to be careful about what you put in your body that’s totally fine and I get it. I also understand if Trump wishes to collect more stats, totally nothing wrong with that either.

However, he is really hyping up Leucovorin as a new FDA approved drug for use to treat autism (which was probably done with pressure from either Trump or RFK or both). Same thing; studies have shown some promise but only a few are double blind and only a few record long term effects, and most are very small studies.

If Tylenol is bad to put into your body, but Leucovorin is fine now with the same body of study, what gives? ",https://www.reddit.com/r/AskConservatives/comments/1no410b/why_is_tylenol_bad_but_leuxovorin_fine_when_both/,7,0,7,40,1758589571.0,/r/AskConservatives/comments/1no410b/why_is_tylenol_bad_but_leuxovorin_fine_when_both/,self.AskConservatives
1npfs16,newjersey,Delicious_Adeptness9,Expert responds to Trump's claim linking Tylenol to autism,"Interview with Dr. Walter Zahorodny, autism researcher at Rutgers",https://www.youtube.com/watch?v=o2lTN-iwkLc&amp;t=227s,144,0,144,19,1758729016.0,/r/newjersey/comments/1npfs16/expert_responds_to_trumps_claim_linking_tylenol/,youtube.com
1nno59l,TheRaceTo10Million,Thereian,Trump Autism Announcement Play,"Today Trump will have a press conference with RFK announcing a breakthrough in Autism research. The market has focused a lot on Tylenol producers due to news that the conference [will link Tylenol use to Autism](https://www.politico.com/news/2025/09/21/trump-autism-tylenol-acetaminophen-fever-00574564).

However, there’s another bigger play not even on the market radar. This morning the FDA [quietly put out a press release](https://www.federalregister.gov/public-inspection/2025-18430/approval-of-previously-withdrawn-new-drug-application-wellcovorin-leucovorin-calcium-tablets) that they’re requesting $GSK to resubmit a formally withdrawn drug for approval in Autism.

[Here’s a relevant X post](https://x.com/alecgaffney/status/1970110267674771934?s=46&amp;t=uefgJpGogAsXoAtQo_xL2A), text pasted here.

“How strange is this?

The drug's original manufacturer, GSK, didn't even ask FDA to do this. 

FDA said it plans to as GSK to submit a supplemental New Drug Application to revise the prescribing information.”

So what’s the play? At today’s press conference, I think Trump and RFK will brag about this new found “treatment.” (I have not reviewed the data and have no opinion on the actual drug effectiveness.)

Nonetheless, $GSK may rally even a little on the news. The IP of the drug has long expired, but in a new indication they’ll get 3 years exclusivity.

The play: weekly calls, $41C. This is highly risky. If nothing gets said in the press conference these are likely a zero. If it does get mentioned or the news picks it up, it could pop a few percent and therefore the calls would go up substantially. I have something close to $65k in calls across 3 accounts.

",https://www.reddit.com/gallery/1nno59l,60,0,60,30,1758551659.0,/r/TheRaceTo10Million/comments/1nno59l/trump_autism_announcement_play/,reddit.com
1np10rv,Harvard,red5,Trump Uses Harvard Public Health School Dean’s Research to Link Tylenol to Autism,,https://www.thecrimson.com/article/2025/9/23/autism-tylenol-study-trump/,71,0,71,28,1758682058.0,/r/Harvard/comments/1np10rv/trump_uses_harvard_public_health_school_deans/,thecrimson.com
1nnnloi,GlobalNews,Prosecco1234,Trump will reportedly link Tylenol to autism - but many experts are sceptical,,https://www.bbc.com/news/articles/cx20d4lr67lo,68,0,68,27,1758550392.0,/r/GlobalNews/comments/1nnnloi/trump_will_reportedly_link_tylenol_to_autism_but/,bbc.com
1nnmj72,nothinghappeninghere,Obvious-Gate9046,"Anti-vaxxers are upset the Trump regime is running with a different and even dumber conspiracy theory than their own for ""the cause for autism"".",,https://i.redd.it/5d9tc49fxpqf1.png,154,0,154,18,1758547791.0,/r/nothinghappeninghere/comments/1nnmj72/antivaxxers_are_upset_the_trump_regime_is_running/,i.redd.it
1nppshn,pregnancy_care,nbcnews,Have the unproven connections RFK Jr. and President Trump have made between Tylenol and autism made you rethink taking the medication?,"We're a group of NBC News reporters hoping to learn whether the links RFK Jr. and President Trump have made between taking Tylenol during pregnancy and autism have any expectant mothers rethinking the medication. Whether in U.S. or elsewhere, we're interested in hearing from you.",https://www.reddit.com/r/pregnancy_care/comments/1nppshn/have_the_unproven_connections_rfk_jr_and/,10,0,10,37,1758752219.0,/r/pregnancy_care/comments/1nppshn/have_the_unproven_connections_rfk_jr_and/,self.pregnancy_care
1nqytfq,PoliticalHumor,Mr_CockSwing,Needs discontinued,,https://i.redd.it/4opx1y3bvhrf1.jpeg,11345,0,11345,55,1758886064.0,/r/PoliticalHumor/comments/1nqytfq/needs_discontinued/,i.redd.it
1nomv2c,TrueAnon,kanelel,Trump isn't ready for recreational autism,,https://i.redd.it/4s7hktk83yqf1.png,147,0,147,17,1758646645.0,/r/TrueAnon/comments/1nomv2c/trump_isnt_ready_for_recreational_autism/,i.redd.it
1noz1ar,TrueUnpopularOpinion,HumbleEngineering315,The whole Tylenol-autism-pregnancy panic should be a push for decentralized healthcare,"Recently, the Trump administration came out and said that [Tylenol was correlated to autism](https://www.youtube.com/live/esKFMCb_hYU?t=266s) in children when taken during pregnancy.

The problem being is that the study that the Trump administration cited showed a very weak correlation between Tylenol and autism. The correlation was hardly enough to act on, much less announce a proclamation. And there was a huge conflict of interest by the authors of the study cited.

Almost immediately, [multiple](https://www.aap.org/en/news-room/fact-checked/acetaminophen-is-safe-for-children-when-taken-as-directed-no-link-to-autism/) [healthcare](https://health.ucdavis.edu/news/headlines/uc-davis-mind-institute-statement-on-acetaminophen-and-autism-/2025/09) [organizations ](https://ysph.yale.edu/news-article/what-the-research-says-about-autism-and-tylenol-use-during-pregnancy/)rebuked the Trump administration on the claims surrounding Tylenol and autism.

What this whole situation highlights is what libertarians have been saying all along: government institutions are prone to political capture and agendas, and private organizations are able to advise the public even better than the government can. . It’s not that private institutions are perfect, but at least you can have competing viewpoints, second opinions, and independent research.

Doctors, labs, and journals don’t all have to agree. That’s a good thing. It gives people the ability to weigh different sources and make informed decisions for themselves. We don’t need one government approved narrative. Especially when that narrative can shift depending on who’s in office.

Decentralized healthcare doesn't mean chaos. It means not being stuck with one politically motivated voice deciding what's safe or unsafe for everyone.",https://www.reddit.com/r/TrueUnpopularOpinion/comments/1noz1ar/the_whole_tylenolautismpregnancy_panic_should_be/,7,0,7,36,1758676304.0,/r/TrueUnpopularOpinion/comments/1noz1ar/the_whole_tylenolautismpregnancy_panic_should_be/,self.TrueUnpopularOpinion
1npr5pk,conspiracy,axthousandxhours,Trump Made Tylenol Claims to Get Rabid Anti-Trumpers to Kill Themselves Doing Anti-Trump TikTok Challenged,,https://i.redd.it/mnveqzzz37rf1.jpeg,0,0,0,37,1758755816.0,/r/conspiracy/comments/1npr5pk/trump_made_tylenol_claims_to_get_rabid/,i.redd.it
1nol14c,inthenews,GregWilson23,"Trump, RFK Jr. distort facts on autism, Tylenol and vaccines, scientists say: ""Sick to my stomach""",,https://www.cbsnews.com/news/trump-rfk-jr-distort-facts-autism-tylenol-vaccines/,258,0,258,7,1758642553.0,/r/inthenews/comments/1nol14c/trump_rfk_jr_distort_facts_on_autism_tylenol_and/,cbsnews.com
1nok6ck,nothinghappeninghere,Obvious-Gate9046,"There's a lot of disinformation and misinformation about autism and acetaminophen (Tylenol) right now, so I put this together so folks have some facts to make arguments with.",,https://i.redd.it/algr2umglxqf1.png,111,0,111,20,1758640620.0,/r/nothinghappeninghere/comments/1nok6ck/theres_a_lot_of_disinformation_and_misinformation/,i.redd.it
1npei73,stupidpol,slightlycringed,Dr. Oz Splits from Trump on Tylenol After Autism Tirade,,https://www.thedailybeast.com/dr-oz-splits-from-trump-on-tylenol-after-autism-tirade/,49,0,49,27,1758726135.0,/r/stupidpol/comments/1npei73/dr_oz_splits_from_trump_on_tylenol_after_autism/,thedailybeast.com
1np044v,DailyShow,JamiroFan2000,Trump Blames Autism on Tylenol While Americans Prep for the Rapture on TikTok,,https://www.youtube.com/watch?v=RTf2MdntsF0,288,0,288,4,1758679428.0,/r/DailyShow/comments/1np044v/trump_blames_autism_on_tylenol_while_americans/,youtube.com
1nov81q,conspiracy,NoResponsibility1728,Trump says taking Tylenol while Pregnant causes Autism,"Why would Trump blame a BRAND NAME, ""Tylenol"" for autism instead of its combination of components?

""Tylenol"" is acetaminophen. There may be differing formulas depending on if you're talking a dry or gel pill, but why blame a brand name instead of a specific formula?

My best guess would be that Trump wants to drive down the sale of Tylenol specifically.

People in his voter base are not going to buy or use Tylenol regardless of pregnancy status if they believe it causes autism, they might even try to get it taken off of store shelves.

They will however, continue to buy and use acetaminophen, because they don't know that Tylenol is just a brand name for it, they'll think Tylenol itself is the autism causing chemical.

Knowing this, acetaminophen will still be used but the Tylenol brand and business will suffer financially and even socially.

So we have to think ""Why would Trump want to take out another business?"". Since that appears to be the true purpose here.

I don't personally know why, but I think we should start doing some research into if Tylenol or the CEO had any conflicts with Trump or his interests.",https://www.reddit.com/r/conspiracy/comments/1nov81q/trump_says_taking_tylenol_while_pregnant_causes/,0,0,0,34,1758665915.0,/r/conspiracy/comments/1nov81q/trump_says_taking_tylenol_while_pregnant_causes/,self.conspiracy
1nn5bp1,autismpolitics,seeebiscuit,Trump administration to link Tylenol use to risk of autism,,https://www.politico.com/news/2025/09/21/trump-autism-tylenol-acetaminophen-fever-00574564,36,0,36,29,1758492881.0,/r/autismpolitics/comments/1nn5bp1/trump_administration_to_link_tylenol_use_to_risk/,politico.com
1nr0ho7,IAmTheMainCharacter,Responsible-Kale-904,"A pregnant women is dying in the hospital of liver failure from overdosing on Tylenol because she wanted to ""Prove Trump Wrong"" about it causing autism. She has no hope of survival, and her husband is there watching his wife and child die because of his wife's TDS.",,https://v.redd.it/klhdofiuzhrf1,0,0,0,34,1758891001.0,/r/IAmTheMainCharacter/comments/1nr0ho7/a_pregnant_women_is_dying_in_the_hospital_of/,v.redd.it
1nnzuto,DeptHHS,FutureComputerDude,Trump and Health and Human Services Secretary Robert F. Kennedy Jr. said the Food and Drug Administration (FDA) will begin updating the label on acetaminophen and will begin notifying physicians that Tylenol “can be associated with a very increased risk of autism.”,,https://thehill.com/policy/healthcare/5516462-trump-acetaminophen-autism-warning/,46,0,46,27,1758578235.0,/r/DeptHHS/comments/1nnzuto/trump_and_health_and_human_services_secretary/,thehill.com
1nqdrx4,politics,usatoday,"Obama calls Trump administration's Tylenol, autism statement 'violence against truth'",,https://www.usatoday.com/story/news/politics/2025/09/25/obama-trump-kennedy-tylenol-autism-announcement/86347110007/,161,0,161,13,1758823095.0,/r/politics/comments/1nqdrx4/obama_calls_trump_administrations_tylenol_autism/,usatoday.com
1nq2nk3,evilautism,Miserable-Piglet9008,Trump when literal doctors tell him Tylenol isn't causing autism.,"I was asked for *more* Trump edits, so here is one of (maybe) many to come.

I will continue to post these (maybe once a day) until I forget *or until a mod tells me off because I am scared of confronting people of powerful positions.*

  
I will not be saying *what* I have edited, that is up to you. I'll confirm or deny guesses (*maybe*).",https://i.redd.it/8kmlw3o3aarf1.png,159,0,159,13,1758794338.0,/r/evilautism/comments/1nq2nk3/trump_when_literal_doctors_tell_him_tylenol_isnt/,i.redd.it
1no3dkn,politics,Plaintalks,Trump and RFK Jr. link autism to Tylenol and doctors push back: key takeaways,,https://www.usatoday.com/story/news/politics/2025/09/22/autism-tylenol-takeaways-trump-rfk-jr/862939210,55,0,55,23,1758587705.0,/r/politics/comments/1no3dkn/trump_and_rfk_jr_link_autism_to_tylenol_and/,usatoday.com
1npmwaw,Virginia,bknutner,Virginia’s autism community responds to Trump administration’s Tylenol claim,,https://www.wvtf.org/news/2025-09-24/virginias-autism-community-responds-to-trump-administrations-tylenol-claim,208,0,208,8,1758745243.0,/r/Virginia/comments/1npmwaw/virginias_autism_community_responds_to_trump/,wvtf.org
1nodlhw,Biohackers,JJCC777,autism tylenol review evidence pretty goodbquality actually. what is the effect size?,"""Evaluation of the evidence on acetaminophen use and neurodevelopmental disorders using the Navigation Guide methodology.""
Diddier Prada, Beate Ritz, …Andrea A. Baccarelli , 8/25.
https://ehjournal.biomedcentral.com/articles/10.1186/s12940-025-01208-0

(forget the messenger!)

this very recent, peer-reviewed, extensive (46 reseach studies), research review, by a reputable set of US institutions, seems to have the sort of characteristics required for Wikipedia medical references.

Subsequent comment by one author seems to possibly imply that she thinks the effect size is small. https://kffhealthnews.org/news/article/trump-autism-announcement-rfk-tylenol-pregnancy-vaccines/

Note: The corresponding author had acted as an expert witness for a plaintiff’s legal team on acetaminophen use during pregnancy and its potential links to neurodevelopmental disorders.",https://www.reddit.com/r/Biohackers/comments/1nodlhw/autism_tylenol_review_evidence_pretty/,0,0,0,33,1758622814.0,/r/Biohackers/comments/1nodlhw/autism_tylenol_review_evidence_pretty/,self.Biohackers
1nqyoho,walkaway,BowlingForAmmo,For all the leftists who are losing their minds because Donald Trump cited a Harvard study linking acetaminophen usage during pregnancy to an increased risk of autism in children...,,https://i.redd.it/9sivwigmthrf1.jpeg,253,0,253,4,1758885612.0,/r/walkaway/comments/1nqyoho/for_all_the_leftists_who_are_losing_their_minds/,i.redd.it
