post_id,subreddit,author,title,selftext,url,ups,downs,score,num_comments,created_utc,permalink,domain
1nodtnk,atlanticdiscussions,Bonegirl06,Trump Tells Pregnant Women to ‘Fight Like Hell’ Not to Take Tylenol,"""At a press conference today, President Donald Trump dispensed one clear piece of medical advice to American parents in a rambling, repetitive monologue: Don’t. Take. Tylenol. He told pregnant women that they could help keep their children safe from autism by not taking the drug whenever they could avoid it (“fight like hell,” he instructed). He advised parents not to give Tylenol to their young children. He denounced giving the hepatitis B vaccine to infants and suggested that parents space out their children’s immunization schedule. (“They pump so much stuff into those beautiful little babies, it’s a disgrace,” he said.) He declared that children ideally should be given the measles, mumps, and rubella vaccines separately, though such individual shots are not available in the United States. “This is based on what I feel,” the president said.

Trump had been hinting at his big announcement for weeks, and it was evident that he wasn’t interested in making sure the contents had passed through the normal research process. “I don’t want to wait any longer. We don’t need anything more. And if it’s wrong—it’s not going to be wrong, but—if it is wrong, it’s fine. We have to do it,” Trump told the audience at a dinner for the American Cornerstone Institute on Saturday. Today, instead of opting for measured guidance, or urging additional research, Trump borrowed a strategy from his health secretary, Robert F. Kennedy Jr.: pushing ahead with a sensational conclusion based on a handful of disputed studies.""

...

""During today’s announcement, Kennedy at least acknowledged the trade-offs inherent in scaring pregnant Americans off Tylenol, and allowed that, sometimes, using it is unavoidable. “The FDA also recognizes that acetaminophen is often the only tool for fevers and pain in pregnancy, as other alternatives have well-documented adverse effects,” Kennedy noted in his remarks. “HHS wants therefore to encourage clinicians to exercise their best judgment in the use of acetaminophen for fevers and pain in pregnancy by prescribing the lowest effective dose and shortest necessary duration, and only when treatment is required.” (Today, the FDA posted an even more measured notice to physicians, signed by Makary, that underscored a possible association between acetaminophen and autism is “an ongoing area of scientific debate.”) Trump, meanwhile, repeatedly instructed pregnant women to “tough it out.” Sowing doubts regarding vaccines, going all in on fringe theories, and opting for extreme positions instead of embracing nuance: At MAHA’s big reveal, Trump seemed determined to steal Kennedy’s spotlight.""
https://www.theatlantic.com/health/2025/09/trump-autism-tylenol-vaccine-maha/684310/",https://www.reddit.com/r/atlanticdiscussions/comments/1nodtnk/trump_tells_pregnant_women_to_fight_like_hell_not/,15,0,15,58,1758623608.0,/r/atlanticdiscussions/comments/1nodtnk/trump_tells_pregnant_women_to_fight_like_hell_not/,self.atlanticdiscussions
1nns2hq,politics,Somervilledrew,Trump report links autism to Tylenol use by pregnant women,,https://www.nydailynews.com/2025/09/22/trump-report-autism-tylenol-acetaminophen-pregnancy/,0,0,0,61,1758560409.0,/r/politics/comments/1nns2hq/trump_report_links_autism_to_tylenol_use_by/,nydailynews.com
1nvikjk,Teenager,summertime-sadness07,If Tylenol cause autism….,"If Tylenol causes autism, does getting an epidural cause Down syndrome🤔? Does drinking beer cause sperm to turn gay? These are serious questions our generation NEEDS to get to the bottom of!! Guys listen to Trump about what you can and can’t put in ur body! #maga #trump2029",https://www.reddit.com/r/Teenager/comments/1nvikjk/if_tylenol_cause_autism/,24,0,24,52,1759348349.0,/r/Teenager/comments/1nvikjk/if_tylenol_cause_autism/,self.Teenager
1notell,Psychiatry,DrAayushRana,Autism and tylenol,What is your take on Trump’s statement regarding antenatal acetaminophen (paracetamol) consumption and increased risk of Autism spectrum disorders?,https://www.reddit.com/r/Psychiatry/comments/1notell/autism_and_tylenol/,26,0,26,54,1758661525.0,/r/Psychiatry/comments/1notell/autism_and_tylenol/,self.Psychiatry
1nofa8j,NoFilterNews,ManchesterNews_MEN,"Trump announces bold new actions to confront rising autism rates in the US, prompting unproven ties between painkiller paracetamol Tylenol, vaccines and autism",,https://www.manchestereveningnews.co.uk/news/world-news/trump-urges-parents-delay-routine-32532699,21,0,21,55,1758628386.0,/r/NoFilterNews/comments/1nofa8j/trump_announces_bold_new_actions_to_confront/,manchestereveningnews.co.uk
1nnhibz,AutisticPride,theautisticcoach,"Blaming Tylenol, vaccines, or anything else for autism is just eugenics","I keep seeing debates about whether autism is “caused” by Tylenol, vaccines, or whatever new scapegoat people invent. Autism isn’t caused by anything. It’s a natural human neurotype. We’ve always been here and we always will.

The whole search for a “cause” is really a search for blame. And blame only makes sense if you think being autistic is bad. That is ableism. It is also the logic of eugenics.

Trump, RFK Jr., and others frame autism as a crisis. They talk about us as a problem to prevent, a mistake to eliminate. That is not neutral policy talk. That is eugenics. Disabled people are always the first to be targeted when society starts talking about prevention and reduction. Autistic people are usually first in line because our society is fundamentally autistiphobic.

And we can’t ignore the economic angle. Capitalism only values bodies that can be exploited for labor. Disabled people are seen as a drain on the system. Autistic people who can’t or won’t conform to capitalist productivity norms are cast as disposable. When politicians talk about the “costs” of autism, they are telling you whose lives they think aren’t worth living.

Liberals who argue about the “real cause” are not defending us either. They are reinforcing the same framework. If you debate causes, you are already accepting that autism is something to fix. That is complicity in ableist and capitalist narratives that mark us as broken.

Autistic liberation means rejecting this whole framework. It means refusing to see ourselves as mistakes or burdens. It means fighting for a world where our lives, our needs, and our ways of being are not only accepted but valued.

Autistic humans are not broken. We are not a crisis. We are not a burden. We are human. And autistic liberation is bound up with disability justice, with dismantling ableism and capitalism, with refusing every form of eugenics.
",https://www.reddit.com/r/AutisticPride/comments/1nnhibz/blaming_tylenol_vaccines_or_anything_else_for/,192,0,192,27,1758532054.0,/r/AutisticPride/comments/1nnhibz/blaming_tylenol_vaccines_or_anything_else_for/,self.AutisticPride
1npet46,libertarianmeme,ColorMonochrome,Leftist “people with ovaries” or “birthing people” or whatever they call them today are chugging Tylenol because Trump said not to.,,https://i.redd.it/srt6xibep4rf1.jpeg,114,0,114,37,1758726802.0,/r/libertarianmeme/comments/1npet46/leftist_people_with_ovaries_or_birthing_people_or/,i.redd.it
1nuyeye,childfree,BusinessPitch5154,Trump blamed acetaminophen for autism not understanding that autism is caused by genetics another reason for birth rate decline faster!!!,As of recently Trump went on TV stating that acetaminophen causes autism which is in Tylenol the only drug moms can take for colds and fevers that are safe during pregnancy. I can't believe he was allowed to say this dangerous bullshit autism isn't a disease they are humans too and blaming moms for this is evil. He basically wants women to be the scapegoat as to why the kid isn't healthy it's fucking disgusting and I'm ashamed our country allowed this. I will never understand how this man was allowed to steal the election and spew this. His retarded self only ensured that the birth rate to decline faster. They are the dumbest administration ever to be in office!! ,https://www.reddit.com/r/childfree/comments/1nuyeye/trump_blamed_acetaminophen_for_autism_not/,189,0,189,25,1759291574.0,/r/childfree/comments/1nuyeye/trump_blamed_acetaminophen_for_autism_not/,self.childfree
1nnl8o2,thescoop,rezwenn,Trump administration to link Tylenol use to risk of autism,,https://www.politico.com/news/2025/09/21/trump-autism-tylenol-acetaminophen-fever-00574564,45,0,45,48,1758544486.0,/r/thescoop/comments/1nnl8o2/trump_administration_to_link_tylenol_use_to_risk/,politico.com
1nof1ah,YAPms,321gamertime,Trump tells pregnant women not to take Tylenol and claims getting vaccines close together increases the risk of autism,,https://i.redd.it/86ac7x2wiwqf1.jpeg,32,0,32,49,1758627643.0,/r/YAPms/comments/1nof1ah/trump_tells_pregnant_women_not_to_take_tylenol/,i.redd.it
1nsqhbi,Defeat_Project_2025,Odd-Alternative9372,Trump’s comments on autism evoke anger and hope among autistic people and their families,"An Indiana woman with an autistic son says President Donald Trump was blaming moms when he made unfounded claims that taking Tylenol while pregnant causes autism.

- A Kentucky woman diagnosed with the condition as an adult thought Trump was villainizing autism by describing it as a “horrible, horrible crisis.”

- A Massachusetts man whose twin boys have profound autism found the Republican president’s words hopeful because it was the first time the father had seen autism discussed at the highest levels of government.

- Recent comments about autism by the Republican president and others in his administration are rippling through the United States, stirring up a wide range of views and feelings among autistic people and their families. Some welcome the renewed focus and pledges of research money for the complex developmental condition. Others are outraged by what they consider the blaming, shaming and spreading claims not grounded in science.

- On Monday, Trump repeatedly warned pregnant women not to take Tylenol, known by the generic name acetaminophen, and he fueled discredited claims about autism and vaccines. Some studies have raised the possibility that taking acetaminophen in pregnancy might be associated with a risk of autism. Many others, however, have not found a connection and no causal link has been proved.

- Meantime, scientists stress that concerns that vaccines could be linked to autism have been long debunked. A fraudulent study claiming a link between the measles, mumps and rubella vaccine was later retracted by the journal that published it. Science has shown autism is mostly rooted in genetics.

- Dr. Noa Sterling, an OB-GYN, said Trump’s comments, particularly about Tylenol, touched a nerve for many parents of young autistic children.

- “There’s this kind of narrative that you have to be careful of absolutely everything you do in pregnancy, and if you eat the wrong thing or do the wrong thing, you’re going to irreparably harm your baby,” she said. “So the Tylenol just plays directly into this fear that, ‘I’ve taken something that has caused this condition in my child.’”

- Dani Derner, who has a 4-year-old autistic son, said it is “really disappointing” that women are being blamed.

- “I personally did not take Tylenol during my pregnancy,” said Derner, of Dripping Springs, Texas. But, she said, “some women might not have a choice.”

- Some women said the blaming was reminiscent of the disproven mid-20th century theory that emotionally cold “refrigerator mothers” caused autism.

- “When I heard that he said acetaminophen was the cause, I was a little scared and a little sad because as a mom of a child with autism, I felt like maybe I was being blamed for that,” said Rachel Deaton of Fishers, Indiana, who has a 22-year-old autistic son. “We really don’t know what causes autism.”

- Kelly Sue Milano of Fullerton, California, who has an autistic son, added: “A lot of responsibility and at times criticism is placed on mothers, I think, in a really unbalanced and unfair way.”

- Some autistic people recoiled at the notion that autism is something to cure.

- “It is part of who we are,” said Dani Bowman, CEO of DaniMation Entertainment and a cast member of “Love on the Spectrum.” “My mom never took Tylenol while she was pregnant with me or my sister. My dad has autism. My sister has autism. I have autism.”

- Katy Thurman, a legal assistant in Lexington, Kentucky, who was diagnosed with autism as an adult, grew angry at the concept of eradicating autism.

- “There are actual crises going on in this country. People being autistic is not one of them,” Thurman said.

- Others were encouraged by the attention on the developmental disorder.

- “We need a voice at the table and we have to do something,” said Matt Murphy of Ayer, Massachusetts, who has twin 8-year-old boys with profound autism. “That’s the hopeful thing I take out of this -– finally, the top level of government is talking about this.”

- He said people with profound autism will need lifetime support, and federal and state governments will need to take action in many areas, including education and housing. Murphy is glad to see federal money going toward research into autism’s causes.

- “Even if you find the cause … we still have the current population that we need to support and address and help,” he said.

- Deaton, who has an adult autistic son, agrees, but worries about federal cuts affecting things such as Medicaid and special education. Those help autistic people contribute to society, get jobs and be taxpayers, she said.

- Judith Ursitti leads the Profound Autism Alliance and was among a group of people who met with the director of the National Institutes of Health in June. She said hearing the term “profound autism” in a White House event was validating and she was pleased with the list of research being funded.

- But Ursitti, mother of a 22-year-old son with autism, realizes that people on other parts of the autism spectrum found some of the language hurtful and that others in her community were outraged because they believe moms were being blamed.

- Ursitti also said some of the discussion was confusing, including the failure to tease out profound autism from other parts of the spectrum when mentioning the statistic that 1 in about 31 children is affected by autism spectrum disorder in the U.S.

- “The vast majority of people with autism don’t fall into that profound category,” she said.

- She said reactions to comments made at the White House were in some ways as diverse as the autism community itself.

- “There’s a divide that’s quite similar to what we’re seeing in our country, honestly,” she said.",https://apnews.com/article/autism-trump-pregnancy-tylenol-65e9c04d05014345364212ecaec4ee3e,249,0,249,18,1759071563.0,/r/Defeat_Project_2025/comments/1nsqhbi/trumps_comments_on_autism_evoke_anger_and_hope/,apnews.com
1nnmivc,politicsinthewild,Obvious-Gate9046,"Anti-vaxxers are upset the Trump regime is running with a different and even dumber conspiracy theory than their own for ""the cause for autism"".",,https://i.redd.it/ghtllbabxpqf1.png,114,0,114,34,1758547767.0,/r/politicsinthewild/comments/1nnmivc/antivaxxers_are_upset_the_trump_regime_is_running/,i.redd.it
1no5sd6,somethingiswrong2024,Snapdragon_4U,Because of course it’s a grift.,,https://i.redd.it/5i0k22xrstqf1.jpeg,3343,0,3343,139,1758594649.0,/r/somethingiswrong2024/comments/1no5sd6/because_of_course_its_a_grift/,i.redd.it
1nojmzj,democrats,Obvious-Gate9046,"There's a lot of disinformation and misinformation about autism and acetaminophen (Tylenol) right now, so I put this together so folks have some facts to make arguments with.",,https://i.redd.it/xujcdrwthxqf1.png,176,0,176,25,1758639437.0,/r/democrats/comments/1nojmzj/theres_a_lot_of_disinformation_and_misinformation/,i.redd.it
1noc8r2,worldevents,LynnK0919,Trump attacks Tylenol as officials unveil highly contentious conclusions on autism | Trump administration,,https://www.theguardian.com/us-news/2025/sep/22/trump-administration-autism-causes,49,0,49,43,1758617648.0,/r/worldevents/comments/1noc8r2/trump_attacks_tylenol_as_officials_unveil_highly/,theguardian.com
1no0chx,conspiracy,jurornumber1,"'Amish have no autism,' claims Trump as he links Tylenol to the condition | News UK Video News","In his press conference today, President Donald Trump made the remarkable claim that Autism is directly related to supplements and pharmaceuticals, and that in Amish communities the rate of autism is ""virtually zero - i heard none"" before fact-checking himself. 

The quote (starting at 1:40 in the video): 

DJT : ""There are certain groups of people that don't take vaccines, and don't take any pills, that have no autism ... that have no autism ... does that tell you something? Is that a correct statement by the way? (turning to RFK Jr.) 

RFK Jr: "" There are some studies that suggest, with the Amish for example - "" (gets cut off)

DJT: ""The Amish... Virtually, i heard none. See Bobby wants to be very careful with what he says, and he should, but i'm not so careful with what i say. But you have certain groups, the Amish for example, they have essentially no Autism.""

So the president just openly admits, in a press conference that they've found the cure for autism, that he doesn't know, and in fact does not care, whether the statements he is making are true. 

[https://www.abtaba.com/blog/amish-kids-get-autism](https://www.abtaba.com/blog/amish-kids-get-autism)

multiple studies have confirmed that there is no statistical difference in autism rates in amish communities compared to non-amish from the same geographical region 

",https://news.sky.com/video/amish-have-no-autism-claims-trump-13436475,42,0,42,45,1758579432.0,/r/conspiracy/comments/1no0chx/amish_have_no_autism_claims_trump_as_he_links/,news.sky.com
1no0idp,USMC,Polvbear,Tylenol and Autism,"Edit: Adding this at the top out of concern someone will read this and take it as gospel. This is a shit post, the link between autism and Tylenol has not been verified in anything approaching a meta analysis or anything resembling what might be described as ""gold standard science.""

________

Good news, you can finally claim your autism as service connected! POTUS/RFK announced Tylenol can cause autism. 

https://www.hhs.gov/press-room/hhs-trump-kennedy-autism-initiatives-leucovorin-tylenol-research-2025.html

Disclaimer: They argue it's caused during pregnancy.

Disclaimer Two: Tylenol was probably only perscribed when there was an ibuprofen shortage. 

Disclaimer Three: This is all under a fair amount of scrutiny by the wider medical community.",https://www.reddit.com/r/USMC/comments/1no0idp/tylenol_and_autism/,35,0,35,46,1758579855.0,/r/USMC/comments/1no0idp/tylenol_and_autism/,self.USMC
1no1e1p,Quebec,Straight_Park74,Autisme | Trump déconseille le Tylenol aux femmes enceintes,,https://www.lapresse.ca/international/etats-unis/2025-09-22/autisme/trump-deconseille-le-tylenol-aux-femmes-enceintes.php,0,0,0,53,1758582183.0,/r/Quebec/comments/1no1e1p/autisme_trump_déconseille_le_tylenol_aux_femmes/,lapresse.ca
1no2k05,antitrump,No-Introduction-1656,Trump once again proves he is THE as*hole: Pregnancy and Tylenol,"So who has seen Trump speak to Tylenol and Autism? I just watched this idiot, who unfortunately is our president , not only could he not manage to pronounce the drug name correctly… not once… not twice…(hold your breath)… but three times.  Is any one surprised? After all, he just recently claimed that he stopped the war between Cambodia and Armenia🤣 But a man who has never experienced a pregnancy had the balls to say, it’s bad, very bad. Don’t take it. I suppose there are cases where you just can’t “tough” it out… I suppose there’s  that”! WTF is happening?!?! Asking for a friend.",https://www.reddit.com/r/antitrump/comments/1no2k05/trump_once_again_proves_he_is_the_ashole/,85,0,85,36,1758585396.0,/r/antitrump/comments/1no2k05/trump_once_again_proves_he_is_the_ashole/,self.antitrump
1nnzo8o,mopolitics,zarnt,"Trump promotes unproven ties between Tylenol, vaccines and autism without new evidence","I haven’t found a link to watch the whole thing but it’s bad. Trump failing to pronounce acetaminophen (normally I don’t like to be a stickler but that’s the purpose of the whole thing, c’mon), lying and saying there’s no autism among the Amish, and telling pregnant women to go without Tylenol because he knows best, obviously. It’s just so bad. I don’t know what else to say. How did we get here? How come so many Americas have no standards in political leadership?",https://apnews.com/article/tylenol-cause-autism-trump-kennedy-0847ee76eedecbd5e9baa6888b567d66,18,0,18,48,1758577774.0,/r/mopolitics/comments/1nnzo8o/trump_promotes_unproven_ties_between_tylenol/,apnews.com
1nor0tf,Health,huffpost,Trump's 'Reckless' Claim About Tylenol And Autism Sparks Concern From Medical Experts,,https://www.huffpost.com/entry/trump-tylenol-medical-experts_l_68d2acf1e4b03fb4d9341baa?utm_medium=Social&amp;utm_source=reddit&amp;utm_campaign=us_main,263,0,263,15,1758656057.0,/r/Health/comments/1nor0tf/trumps_reckless_claim_about_tylenol_and_autism/,huffpost.com
1no7n2r,Popculturenow,SmokeMaleficent9498,Trump blames Tylenol for autism. Science doesn't back him up,"Wasn't Trump who suggested bleach injections to cure Covid.

Research doesn’t show using Tylenol during pregnancy causes autism.

After years of research, no study has shown that acetaminophen, the main ingredient in Tylenol, causes autism. There's no known single cause of autism, a neurological condition that influences how someone acts and communicates.

But some scientific terms, like ""association,"" can confuse the issue. There's some research that says there's an association between taking acetaminophen during pregnancy and autism. There's also some research that says there's not an association.

But either way, there's an important caveat: ""Association"" is not the same as causation. That means that research showing an association between the medication and autism doesn't mean the medication caused autism.",https://i.redd.it/vqcupi4t9uqf1.jpeg,62,0,62,39,1758600375.0,/r/Popculturenow/comments/1no7n2r/trump_blames_tylenol_for_autism_science_doesnt/,i.redd.it
1nom9p2,WeirdGOP,Carbenzero,"Tylenol is going to make billions on Trump, Dr Oz and RFK jr.",,https://i.redd.it/660o1degzxqf1.jpeg,302,0,302,11,1758645321.0,/r/WeirdGOP/comments/1nom9p2/tylenol_is_going_to_make_billions_on_trump_dr_oz/,i.redd.it
1no43t5,WhitePeopleTwitter,Dr_sc_Harlatan,"Autism was discovered in 1911, and Tylenol was invented in 1950!",https://bsky.app/profile/gtconway.bsky.social/post/3lzhnzpdg3k2w,https://i.redd.it/ysjkdkccetqf1.jpeg,230,0,230,17,1758589794.0,/r/WhitePeopleTwitter/comments/1no43t5/autism_was_discovered_in_1911_and_tylenol_was/,i.redd.it
1no6td6,BoomersBeingFools,goodPointMadam,Trump: Tylenol Causes Autism. WHAT THE FUCK ARE THE FEDS SMOKING!?,,https://v.redd.it/5pbcnle85sqf1,70,0,70,35,1758597790.0,/r/BoomersBeingFools/comments/1no6td6/trump_tylenol_causes_autism_what_the_fuck_are_the/,v.redd.it
