post_id,subreddit,author,title,selftext,url,ups,downs,score,num_comments,created_utc,permalink,domain
1nnyhzb,Fauxmoi,Diedalonglongtimeago,Trump officially announces Tylenol causes autism while bumbling and struggling to say Acetaminophen,,https://v.redd.it/x0o7ayz26sqf1,24658,0,24658,2063,1758574914.0,/r/Fauxmoi/comments/1nnyhzb/trump_officially_announces_tylenol_causes_autism/,v.redd.it
1nn4gqz,politics,wizardofthefuture,Trump administration to link Tylenol use to risk of autism,,https://www.politico.com/news/2025/09/21/trump-autism-tylenol-acetaminophen-fever-00574564,14692,0,14692,2060,1758490683.0,/r/politics/comments/1nn4gqz/trump_administration_to_link_tylenol_use_to_risk/,politico.com
1no1rw5,autism,WindermerePeaks1,US - Fact Checking Trump and RFK's remarks on the cause of Autism,"For those that aren't aware, president Trump had a press conference two hours ago about finding the cause of Autism. He was not fact checked, but we are doing our best to do that for you.

For the sake of clarity across countries, acetaminophen, paracetamol, and tylenol are the same drug.

Trump's main statements were:

1. Autism is an epidemic
2. Acetaminophen use during pregnancy causes autism, pregnant people shouldn't take it, and there's ""no downside to not taking it"". And says places like Cuba can’t afford tylenol so they don’t use it and they “have virtually no autism”. 
3. Hepatitis B vaccines should not be given until the age of 12 because Hep B is a sexually transmitted disease and babies don't have sex.
4. Children are ""loaded up with"" as many as 80 vaccines at once. 
5. He stated that the Amish community has very little autism due to not getting vaccinated or taking tylenol.  
5. RFK said the department identified an ""exciting therapy that may benefit large numbers of children who suffer from autism."" Referring to Leucovorin.  
6. 70% of mothers believe that vaccines caused their child’s autism and that we should “believe the women”. 

## **FACT CHECKS** 

**EPIDEMIC CLAIMS**   

1. The rates of autism have increased largely due to increased awareness of the disorder and changes in how it is classified by medical professionals. This rate that is referenced is based on diagnosis and doesn't necessarily mean autism itself has increased, just that diagnosis have. 
2. Every time there’s been a significant increase in autism diagnoses, it’s after a new edition of the DSM is published. Autism diagnoses skyrocketed after 1980 because the DSM-III was published that year, and in that edition autism was officially separated from schizophrenia and reclassified as a communication disorder. There was another increase after 2013 when the DSM-V was published with “autism spectrum disorder” as a developmental disorder, instead of five separate disorders. In order to understand how autism is not an epidemic, we have to look at how the meaning (and diagnostic criteria and diagnosis rates) has changed over time. https://pmc.ncbi.nlm.nih.gov/articles/PMC3757918/  
2. The definition of epidemic is “a widespread occurrence of an infectious disease in a community at a particular time” - oxford, “an outbreak of disease that spreads quickly and affects many individuals at the same time” - marriam webster, “sudden disease outbreak that affects a large number of people in a particular region, community, or population” -national geographic.  
3. Autism however has gradually increased over the years. It’s not an immediate change. 

    - Compared to 20 years ago, we're now seeing more children identified with autism who identify as Black, Asian, and Pacific Islander than white. We used to think primarily white boys were impacted by autism, but now we see it's all of us—many of our communities have children with autism in them—and not just boys. Over 1% of girls are identified with autism.
    - So, we know the number of children identified with autism is increasing.
    - There has been a nearly 300% increase over the past 20 years, but if you look at any two-year period across the sites that are monitoring the number of children identified with autism, it’s somewhere between a 10%–20% increase every two years. https://publichealth.jhu.edu/2025/is-there-an-autism-epidemic

**VACCINES**  

1. Hepatitis B is transmitted during birth and children can also come into contact with it through household objects like razors, toothbrushes, and towels.
2. Children are not ""loaded up"" with 80 vaccines at a time. The CDC has developed the childhood vaccine schedule over decades, in close consultation with experts, based on thorough reviews of safety and efficacy evidence.  The schedule can be found here: https://my.clevelandclinic.org/health/articles/11288-childhood-immunization-schedule. No one has ever gotten 80 vaccines at a time. He also stated they should break up the MMR vaccine into four or five doses. The MMR (measles, mumps, and rubella) only consists of three vaccines. Vaccines are combined because it reduces the amount of pokes that have to be done. Before a combination vaccine is approved for use, it goes through careful testing to make sure the combination vaccine is as safe and effective as each of the individual vaccines given separately. https://www.cdc.gov/vaccines-children/about/combination-vaccines.html  
3. During the press conference, Trump said he’s a believer in vaccines but claimed without evidence that giving vaccinations close together at the recommended ages has a link to autism. Spacing out shots as he suggests can lead to an increased risk that children become infected with a vaccine-preventable disease before returning for another visit. Though anti-vaccine activists, including Kennedy, have long suggested a link between vaccines and autism, **widespread scientific consensus and decades of studies have firmly concluded there isn’t one**.
4. As for the Amish claims, it’s very hard to actually know. There’s not a lot of data. One paper published in 2010 https://imfar.confex.com/imfar/2010/webprogram/Paper7336.html said, “Preliminary data have identified the presence of ASD in the Amish community at a rate of approximately 1 in 271 children using standard ASD screening and diagnostic tools although some modifications may be in order.” That rate was lower than the general population (which at the time was 1 in 91) the paper noted, but that could be due to a variety of factors, including differences in how caregivers answered screening questions or genetic differences. The sample taken for the study was 1,899 children from two Amish communities. The DSM IV was used. This is important because the diagnostic criteria was different, as asperger’s, pervasive developmental disorder, and autistic disorder were combined. While something may be here, it’s still inconclusive. The vaccination rates among the Amish are also hard to know because there’s not much data, but one paper from 2017 https://www.sciencedirect.com/science/article/pii/S0196655317300962?via%3Dihub found that 98% of the parents surveyed vaccinated their children. Another paper from 2011 https://publications.aap.org/pediatrics/article/128/1/79/30323/Underimmunization-in-Ohio-s-Amish-Parental-Fears?autologincheck=redirected found that 85% had vaccinated at least some of their children. 

**ACETAMINOPHEN**  

1. Pregnant women are already advised to take acetaminophen sparingly, according to the American College of Obstetricians and Gynecologists. Fevers pose a risk to both the mother and the developing fetus. Studies that have been conducted to evaluate a connection between acetaminophen use and autism have so far been **inconclusive.** Multiple agencies around the world have determined the risk is inconclusive, meaning **there is no established risk.**  
2. Dr. Steven J. Fleischman, the president of the American College of Obstetricians and Gynecologists issued a statement two hours ago stressing that acetaminophen is considered safe. ""The conditions people use acetaminophen to treat during pregnancy are far more dangerous than any theoretical risks and can create severe morbidity and mortality [death] for the pregnant person and the fetus.   
3. The Trump Administration is citing [a literature review published last month](https://ehjournal.biomedcentral.com/articles/10.1186/s12940-025-01208-0). Outside researchers have reviewed that article saying the review wasn’t rigorously conducted and that it cherry picked studies that supported its conclusion. The review’s senior author, Andrea Baccarelli, served in 2023 as a paid expert in a class action lawsuit against acetaminophen manufacturers, in which he testified that there was a link between the medication and autism. A judge excluded his testimony for being **scientifically unsound** and last year **dismissed the case, which is currently under appeal.** (This means that the author of a review paper that Trump is using to back the claims is biased. That case is ongoing).  
3. Other autism researcher have pointed to a large study last year [published in the Journal of the American Medical Association](https://jamanetwork.com/journals/jama/fullarticle/2817406) which found **no link between acetaminophen use in pregnancy and autism, ADHD, or intellectual disability.**   

    - This study analyzed data from more than 2.4 million children. When the researchers looked solely at children with autism, there was a small increased risk possibly associated with acetaminophen. But when the researchers compared siblings within the same families the link disappeared. The comparison allowed them to control for variables that past studies couldn’t. Siblings share a large part of their genetic background and often have similar environmental exposures in utero and at home.
    - “The biggest elephant in the room here is genetics,” Lee said. “We know that autism, ADHD and other neurodevelopmental disorders are highly heritable.”  

**LEUCOVORIN**  

Leucovorin is a form of Vitamin B. It has never before been **approved** for autism symptoms, though it has been used “off label”for some autism symptoms. The FDA has issued a statement that they are approving its usage for a subset of children with autism who have ""cerebral folate deficiency."" Cerebral folate deficiency can be diagnosed via a lumbar puncture (spinal tap) or with a FRAT test. 

**No clinical trials have been done**. The FDA's endorsement of the drug without the company submitting clinical trials to treat kids with autism is **highly unusual.**

The science regarding leucovorin and autism ""is still in very early stages, and more studies are necessary before a definitive conclusion can be reached,” the Autism Science Foundation said in a statement.  

The data in favor of treatment with leucovorin is “from four small randomized controlled trials, all using different doses and different outcomes, and in one case, reliant on a specific genetic variant,” the Foundation notes [on its website](https://autismsciencefoundation.org/press_releases/statement-from-autism-science-foundation-regarding-wall-street-journal-report-rfk-jr-hhs-to-link-autism-to-tylenol-use-in-pregnancy-and-folate-deficiencies/). It’s important to note as well that these studies only had a small sample size, 40 or 50 patients. In the research world, that’s a very small sample size. It doesn’t mean it’s bad, just that there **isn’t enough data yet**. 

Dr. David Mandell, a professor of psychiatry and autism expert at the University of Pennsylvania, told Reuters that leucovorin might well be a possible treatment for some children with autism, ""but the evidence we have supporting it... is really, really weak."" 

**The Autism Science Foundation [does not endorse leucovorin as a treatment for autism](https://autismsciencefoundation.org/beware-of-non-evidence-based-treatments)**, saying in a statement that “more studies are necessary before a conclusion can be reached.”

Side effects may include gastrointestinal distress, weakness, fatigue, decreased appetite, changes in taste and hair loss. Allergic reactions, seizures and infections may occur in rare but severe cases.

The long-term effects of the drug are unknown.

It’s important to note that of the doctors using leucovorin for autism that leucovorin on its own **isn’t a cure-all**. Dr. Richard Frye, a pediatric neurologist researching leucovorin as a potential autism treatment said that while his patients were taking the medication, they also continued other therapeutic interventions, such as applied behavior analysis and speech therapy.

Despite this, the Trump Administration has decided to fast track FDA approval of leucovorin for the treatment of autism. 

**This post will be updated with fact checks as we get them.**

## **UK Response** 

Here's the UK response. Adding this because it’s very important to verify information across sources, it helps to make sure that it’s accurate because you have multiple people from multiple places backing it up.

https://www.bbc.co.uk/news/articles/cg4230d0x0go here's the UK health secretary (RFK equivalent) 

https://www.gov.uk/government/news/mhra-confirms-taking-paracetamol-during-pregnancy-remains-safe-and-there-is-no-evidence-it-causes-autism-in-children (FDA equivalent)

## Sources: 

1. https://www.youtube.com/watch?v=esKFMCb_hYU (Full press conference)  
2. https://www.nbcnews.com/politics/trump-administration/live-blog/trump-rfk-jr-autism-china-tiktok-shutdown-h1-b-kirk-bondi-live-updates-rcna232650  
3. https://www.reuters.com/business/healthcare-pharmaceuticals/why-is-leucovorin-being-considered-an-autism-treatment-2025-09-22/  
4. https://www.theguardian.com/us-news/2025/sep/22/trump-administration-autism-causes  
5. https://www.nytimes.com/live/2025/09/22/us/trump-news  
6. https://www.nytimes.com/2025/09/16/well/hepatitis-b-vaccine-rfk-jr.html  
7. https://nypost.com/health/what-is-leucovorin-inside-the-drug-giving-new-hope-to-autism-patients/  
8. https://apnews.com/article/tylenol-cause-autism-trump-kennedy-0847ee76eedecbd5e9baa6888b567d66  
9. https://www.factcheck.org/2023/07/scicheck-false-claim-about-cause-of-autism-highlighted-on-pennsylvania-senate-panel/  
10. https://abcnews.go.com/Health/fact-checking-president-donald-trumps-claims-autism/story?id=125838403  

(If anything is behind a paywall for you, you can go to archive.org to see the article). ",https://www.reddit.com/r/autism/comments/1no1rw5/us_fact_checking_trump_and_rfks_remarks_on_the/,994,0,994,351,1758583224.0,/r/autism/comments/1no1rw5/us_fact_checking_trump_and_rfks_remarks_on_the/,self.autism
1nnyh26,Conservative,ancienteggfart,Trump set to announce using Tylenol while pregnant could raise autism risk,,https://nypost.com/2025/09/22/us-news/trump-admin-set-to-announce-using-tylenol-while-pregnant-could-raise-autism-risk/,2338,0,2338,932,1758574858.0,/r/Conservative/comments/1nnyh26/trump_set_to_announce_using_tylenol_while/,nypost.com
1nn231s,medicine,Shalaiyn,"Trump administration set to tie paracetamol/acetaminophen to autism risk, officials say","[Source](https://www.washingtonpost.com/health/2025/09/21/trump-autism-announcement-tylenol-leucovorin/?utm_source=reddit.com)

They're also setting out folinic acid as a treatment for autism. It's not my field at all, from the looks of it the evidence on it is very controversial (systematic review: Hoxha et al. 2021 Cel**ls) or absent (review: Vasconcelos et al. 2025 *Nutr Neurosci*). Anyone with more expertise care to pitch in?",https://www.reddit.com/r/medicine/comments/1nn231s/trump_administration_set_to_tie/,985,0,985,267,1758485015.0,/r/medicine/comments/1nn231s/trump_administration_set_to_tie/,self.medicine
1nnywlx,politics,peoplemagazine,"Trump Claims Tylenol Causes Autism, Declares 'Life Is Common Sense' in Press Conference with RFK Jr. and Dr. Oz",,https://people.com/trump-rfk-jr-says-tylenol-causes-autism-11814830?utm_campaign=peoplemagazine&amp;utm_medium=social&amp;utm_source=reddit.com&amp;utm_content=post,623,0,623,415,1758575872.0,/r/politics/comments/1nnywlx/trump_claims_tylenol_causes_autism_declares_life/,people.com
1no095s,AskUS,Angry-mango7,Trump &amp; Autism. Let’s discuss,"Autism was first diagnosed in the 40’s, Tylenol was invented in the 50’s. The science does not support his statements. MAGA, how do you feel about the outright lies? Is it enough for you to question your loyalty yet? AMA, my Master of Science concentration is on ASD. ",https://www.reddit.com/r/AskUS/comments/1no095s/trump_autism_lets_discuss/,198,0,198,201,1758579195.0,/r/AskUS/comments/1no095s/trump_autism_lets_discuss/,self.AskUS
1no69q2,Conservative,swan8895,"Trump announces FDA will change Tylenol safety label, urges pregnant mothers to prevent autism risk in children: ‘Don’t take it!’",,https://nypost.com/2025/09/22/us-news/trump-announces-fda-will-change-tylenol-safety-label-urges-pregnant-mothers-to-prevent-autism-risk-in-children/,417,0,417,313,1758596121.0,/r/Conservative/comments/1no69q2/trump_announces_fda_will_change_tylenol_safety/,nypost.com
1nouvbe,politics,thedailybeast,Dr. Oz Splits from Trump on Tylenol After Autism Tirade,,https://www.thedailybeast.com/dr-oz-splits-from-trump-on-tylenol-after-autism-tirade/,21414,0,21414,1024,1758665041.0,/r/politics/comments/1nouvbe/dr_oz_splits_from_trump_on_tylenol_after_autism/,thedailybeast.com
1nq3ioi,news,AudibleNod,Scientist behind autism study cited by Trump admin paid $150K by plaintiffs suing Tylenol manufacturer,,https://www.denver7.com/health/scientist-behind-autism-study-cited-by-trump-admin-paid-150k-by-plaintiffs-suing-tylenol-manufacturer,27504,0,27504,565,1758797455.0,/r/news/comments/1nq3ioi/scientist_behind_autism_study_cited_by_trump/,denver7.com
1no3mat,politics,Silly-avocatoe,"Trump, 79, Struggles to Say Word for Tylenol in His Dumb Autism Speech",,https://newrepublic.com/post/200772/donald-trump-tylenol-pregnancy-autism-rant,13365,0,13365,649,1758588399.0,/r/politics/comments/1no3mat/trump_79_struggles_to_say_word_for_tylenol_in_his/,newrepublic.com
1nnz9vh,law,PhraseFirst8044,could johnson and johnson (who holds the trademark for tylenol which trump is repeatedly using to say causes autism currently) sue the admin for defaming their product?,,https://apnews.com/live/donald-trump-news-updates-9-22-2025,12862,0,12862,593,1758576776.0,/r/law/comments/1nnz9vh/could_johnson_and_johnson_who_holds_the_trademark/,apnews.com
1nn818f,politics,SterlingVII,"Trump Administration to Link Tylenol to Autism, WaPo Reports",,https://www.bloomberg.com/news/articles/2025-09-21/trump-administration-to-link-tylenol-to-autism-wapo-reports,6456,0,6456,990,1758500278.0,/r/politics/comments/1nn818f/trump_administration_to_link_tylenol_to_autism/,bloomberg.com
1nongag,LivestreamFail,Intelligent-Ad-4260,xQc pushes back on Trump's tylenol claim by saying autism rise is from better diagnosis,,https://kick.com/xqc/clips/clip_01K5VRTYRWYS29RMHD1C4S2SZB,8142,0,8142,626,1758647972.0,/r/LivestreamFail/comments/1nongag/xqc_pushes_back_on_trumps_tylenol_claim_by_saying/,kick.com
1np2ooo,changemyview,Tessenreacts,CMV: The conservative view on Tylenol and autism is a tragic indictment of American anti-intellectualism.,"President Trump and members of his cabinet have continued their crusade against autism, through now stating that Tylenol (moreso the components of it) causes autism. This also goes hand in hand with statements made in March stating that people with autism don't have jobs and aren't contributing members of society.

This renewed push against autism through stating that Tylenol causes autism, is not only objectively incorrect, it's part of the conservative effort to replace rigid peer reviewed and tested academia, with reactionary approaches and policies that exclusively sounds good on paper and in their heads, but falls apart when examined with even the lightest impartial research into the subject. 

American anti-intellectualism DEFINITELY isn't exclusively a conservative phenomenon, as members of the left absolutely engages in that behavior as well, but conservatives consistently are the loudest and most willing to turn their anti-intellectual viewpoints into actual political policy.

But the Tylenol and autism issue is only a symptom of the core problem that is anti-intellectualism, and American appeal to reactionary approaches rather than engaging in the peer review process to actually make sure that what they are saying is correct.

Would love to have my view changed.   ",https://www.reddit.com/r/changemyview/comments/1np2ooo/cmv_the_conservative_view_on_tylenol_and_autism/,4444,0,4444,1165,1758687263.0,/r/changemyview/comments/1np2ooo/cmv_the_conservative_view_on_tylenol_and_autism/,self.changemyview
1nnm18d,skeptic,onefornought,Tylenol has not been shown to cause autism,"It is reckless and irresponsible of the Trump administration to announce a causal link between acetaminophen and autism in the absence of solid research demonstrating such a link. Scientific conclusions are not made by Presidential decree.

[https://jamanetwork.com/journals/jama/fullarticle/2817406](https://jamanetwork.com/journals/jama/fullarticle/2817406)",https://www.reddit.com/r/skeptic/comments/1nnm18d/tylenol_has_not_been_shown_to_cause_autism/,6471,0,6471,590,1758546561.0,/r/skeptic/comments/1nnm18d/tylenol_has_not_been_shown_to_cause_autism/,self.skeptic
1nnn201,LeopardsAteMyFace,bassbeatsbanging,"Johnson and Johnson gave Trump a cool million. Now RFK Jr.'s sham Autism study blames Tylenol, frequently using the proper brand name instead of the generic  term acetaminophen.",,https://i.redd.it/szw395ga1qqf1.jpeg,9548,0,9548,347,1758549095.0,/r/LeopardsAteMyFace/comments/1nnn201/johnson_and_johnson_gave_trump_a_cool_million_now/,i.redd.it
1nnpskx,facepalm,Snapdragon_4U,Trump administration to link Tylenol use to risk of autism,,https://www.politico.com/news/2025/09/21/trump-autism-tylenol-acetaminophen-fever-00574564,3261,0,3261,600,1758555340.0,/r/facepalm/comments/1nnpskx/trump_administration_to_link_tylenol_use_to_risk/,politico.com
1nodbme,LivestreamFail,davidkale931,Destiny goes off on Trump linking Tylenol use with autism,,https://kick.com/destiny/clips/clip_01K5V09ATQ4C4TSMGKWVV54WDS,2779,0,2779,694,1758621826.0,/r/LivestreamFail/comments/1nodbme/destiny_goes_off_on_trump_linking_tylenol_use/,kick.com
1note6h,technology,esporx,"Scientist behind Trump’s Tylenol claims was paid $150K to give evidence against drug maker.  The Harvard academic Andrea Baccarelli gave an ‘unreliable’ testimony on the links between autism and paracetamol, and produced research that raises ‘serious concerns about bias’",,https://www.thetimes.com/article/aa7fff5a-d267-440f-a544-a3cd75c33416?shareToken=611919e0fb6c955b414a8600a98656e7,8207,0,8207,210,1758661498.0,/r/technology/comments/1note6h/scientist_behind_trumps_tylenol_claims_was_paid/,thetimes.com
1no4ol8,law,blahblah19999,So how will Tylenol and its parent company react to this announcement about Tylenol and autism? Have trump and rfk jr opened the door to a libel or defamation suit?,,https://www.cnn.com/2025/09/22/health/trump-autism-announcement-cause-tylenol,2491,0,2491,348,1758591438.0,/r/law/comments/1no4ol8/so_how_will_tylenol_and_its_parent_company_react/,cnn.com
1npogy9,politics,starlight_collector,WHO rejects Trump’s claims of link between Tylenol and autism,,https://www.theguardian.com/world/2025/sep/24/world-health-organization-trump-autism-tylenol,6484,0,6484,162,1758748973.0,/r/politics/comments/1npogy9/who_rejects_trumps_claims_of_link_between_tylenol/,theguardian.com
1nogykw,Humanitydool,Sextrexer,"Trump, 79, rambles that the Amish and even Cuba don’t have autism because they don’t take Tylenol: Video",,https://wtfdetective.blog/trump-79-amish-cuba-autism-tylenol/,1831,0,1831,493,1758632977.0,/r/Humanitydool/comments/1nogykw/trump_79_rambles_that_the_amish_and_even_cuba/,wtfdetective.blog
